<?xml version="1.0"?>
<Transmission xmlns:xsi="http://www.w3.org/2001/XMLSchema-instance" xsi:noNamespaceSchemaLocation="/var/opt/apps/RT/schemas/upgrade_alpha_request.xsd">
	<Payload>
		<PayloadHeader>
			<PayloadID>99999999999999999999</PayloadID>
			<Target>PROD-WDW</Target>
			<Version>1.0</Version>
			<Comm>
				<Protocol>IP</Protocol>
				<Method>Network</Method>
			</Comm>
			<TransmitDate>2009-01-23</TransmitDate>
			<TransmitTime>11:38:20.123</TransmitTime>
			<TktSeller>
				<TSMAC>TSMACTSMAC</TSMAC>
				<TSSystem>CC</TSSystem>
				<TSLocation>A352R</TSLocation>
				<TSSecurity>WaltDisney1</TSSecurity>
			</TktSeller>
			<CommandCount>1</CommandCount>
		</PayloadHeader>
		<Command>
			<CommandHeader>
				<CmdItem>1</CmdItem>
				<CmdTimeout>45</CmdTimeout>
				<CmdDate>2009-01-23</CmdDate>
				<CmdTime>11:38:20.456</CmdTime>
				<CmdInvoice>942871739062978</CmdInvoice>
				<CmdDevice>DEVICE</CmdDevice>
				<CmdOperator>BOBSMITH</CmdOperator>
				<CmdActor>MGR</CmdActor>
				<CmdNote>This is a command note.</CmdNote>
				<CmdMarket>32832</CmdMarket>
				<CmdAttribute>
					<AttribName>AttributeNameOne</AttribName>
					<AttribValue>AttributeValueOne</AttribValue>
				</CmdAttribute>
				<CmdAttribute>
					<AttribName>AttributeNameTwo</AttribName>
					<AttribValue>AttributeValueTwo</AttribValue>
				</CmdAttribute>
			</CommandHeader>
			<UpgradeAlphaRequest>
				<Ticket>
					<TktItem>1</TktItem>
					<ProdCode>PRD11</ProdCode>
					<ProdPrice>500.05</ProdPrice>
					<TktID>
                        <TktDSSN>
                            <TktDate>2008-11-01</TktDate>
                            <TktSite>WMK</TktSite>
                            <TktStation>111</TktStation>
                            <TktNbr>222</TktNbr>
                        </TktDSSN>
					</TktID>
					<TktShell>78</TktShell>
				</Ticket>				
				<Ticket>
					<TktItem>2</TktItem>
					<ProdCode>PRD11</ProdCode>
					<ProdPrice>500.05</ProdPrice>
					<TktID>
						<Mag>
							<MagTrack1> BBBBBBBBBBBBBBBBBB </MagTrack1>
							<MagTrack2>22=222222</MagTrack2>
						</Mag>
					</TktID>
					<TktShell>78</TktShell>
					<TktMarket>32832</TktMarket>
					<TktNote>This is a ticket note</TktNote>
				</Ticket>
				<Ticket>
					<TktItem>3</TktItem>
					<ProdCode>PRD11</ProdCode>
					<ProdPrice>500.05</ProdPrice>
					<TktID>
						<Barcode>33333333333333333333</Barcode>
					</TktID>
					<TktShell>78</TktShell>
				</Ticket>
				<Ticket>
					<TktItem>4</TktItem>
					<ProdCode>PRD11</ProdCode>
					<ProdPrice>500.05</ProdPrice>
					<TktID>
						<TktNID>44444444444444444</TktNID>
					</TktID>
					<TktShell>78</TktShell>
				</Ticket>
				<Ticket>
					<TktItem>5</TktItem>
					<ProdCode>PRD11</ProdCode>
					<ProdPrice>500.05</ProdPrice>
					<TktID>
						<External>5555555555555555</External>
					</TktID>
					<TktShell>78</TktShell>
				</Ticket>
			</UpgradeAlphaRequest>
		</Command>
	</Payload>
</Transmission>