<?xml version="1.0" ?>
<Transmission xmlns:xsi="http://www.w3.org/2001/XMLSchema-instance" xsi:noNamespaceSchemaLocation="/var/opt/apps/RT/schemas/upgrade_alpha_request.xsd">
	<Payload>
		<PayloadHeader>
			<PayloadID>4231245126936660</PayloadID>
			<Target>Prod-DLR</Target>
			<Version>1.0</Version>
			<Comm>
				<Protocol>IP</Protocol>
				<Method>NETWORK</Method>
			</Comm>
			<TransmitDate>2009-06-25</TransmitDate>
			<TransmitTime>11:17:09.266</TransmitTime>
			<TktSeller>
				<TSMAC>VLINK</TSMAC>
				<TSSystem>VLINK</TSSystem>
				<TSLocation>97016000002</TSLocation>
				<TSSecurity>VLINK</TSSecurity>
			</TktSeller>
			<CommandCount>1</CommandCount>
		</PayloadHeader>
		<Command>
			<CommandHeader>
				<CmdItem>1</CmdItem>
				<CmdTimeout>30</CmdTimeout>
				<CmdDate>2009-06-25</CmdDate>
				<CmdTime>08:17:08.00</CmdTime>
				<CmdInvoice>1460467</CmdInvoice>
				<CmdDevice>3</CmdDevice>
				<CmdOperator>00000000</CmdOperator>
			</CommandHeader>
			<UpgradeAlphaRequest>
				<Ticket>
					<TktItem>1</TktItem>
					<ProdCode>113163</ProdCode>
					<ProdPrice>99.00</ProdPrice>
					<TktID>
						<External>6052742643077765</External>
					</TktID>
				</Ticket>
			</UpgradeAlphaRequest>
		</Command>
	</Payload>
</Transmission>